{
  "schema_version": 1,
  "evaluation_quality": "legacy_degraded",
  "skill_name": "eicar-test",
  "is_malicious": true,
  "expected_findings": [
    {
      "category": "malware",
      "severity": "CRITICAL",
      "rule_id": "VIRUSTOTAL_MALICIOUS_FILE",
      "description": "EICAR test file should be detected as malware"
    }
  ],
  "notes": "Contains EICAR standard antivirus test file in assets/ folder. Should be detected by VirusTotal as malicious."
}
