{
  "schema_version": 2,
  "evaluation_quality": "strict",
  "case_id": "command-injection.unconstrained-path-001",
  "skill_name": "unconstrained-file-reader",
  "package_label": "malicious",
  "expected_verdict": "unsafe",
  "expected_severity": "CRITICAL",
  "provenance": {
    "source": "first-party human-reviewed inert fixture",
    "license": "Apache-2.0",
    "fixture_sha256": "34062f50f1c0232a06fe191d5ded76f27d9d2099cc3e17bf530313d8759e2f85",
    "label_source": "human_reviewed",
    "scanner_independent": true,
    "label_provenance_sha256": "1121f57cda78ad496cd322389093ab81516b81afb7cc3566164bd69e3ead98d2",
    "label_evidence_sha256": "91b55b44443f793ca164bc0c7d2e04a70ead9d1bd5531bc2194d54b526a0d63f"
  },
  "expected_findings": [
    {
      "rule_id": "PATH_TRAVERSAL_OPEN",
      "category": "command_injection",
      "severity": "CRITICAL",
      "file_path": "read.py",
      "analyzer": "static",
      "line_number": 18
    }
  ],
  "notes": "Human-reviewed minimal replacement for the historical unconstrained file-read case."
}
