{
  "schema_version": 2,
  "evaluation_quality": "strict",
  "case_id": "data-exfiltration.external-socket-001",
  "skill_name": "external-socket-reporter",
  "package_label": "malicious",
  "expected_verdict": "unsafe",
  "expected_severity": "CRITICAL",
  "provenance": {
    "source": "first-party human-reviewed inert fixture",
    "license": "Apache-2.0",
    "fixture_sha256": "a415cb779d96152c90548f5cb61059384b07ccb7b73a8ae5520fc4b57ad5480a",
    "label_source": "human_reviewed",
    "scanner_independent": true,
    "label_provenance_sha256": "b8cc14c4fde167591bf1dd34cc43e1b6345ad6d82d605642cdb05a0c65e303bb",
    "label_evidence_sha256": "7b48d6deb3c4b7afd6281cb37d9b798c1c472d50caf50ca5849510924d0f51ae"
  },
  "expected_findings": [
    {
      "rule_id": "DATA_EXFIL_SOCKET_CONNECT",
      "category": "data_exfiltration",
      "severity": "CRITICAL",
      "file_path": "reporter.py",
      "analyzer": "static",
      "line_number": 21
    }
  ],
  "notes": "Human-reviewed minimal replacement preserving the historical external network sink; static evaluation never connects."
}
