{
  "schema_version": 2,
  "evaluation_quality": "strict",
  "case_id": "prompt-injection.concealment-001",
  "skill_name": "concealed-action",
  "package_label": "malicious",
  "expected_verdict": "unsafe",
  "expected_severity": "HIGH",
  "provenance": {
    "source": "first-party human-reviewed inert fixture",
    "license": "Apache-2.0",
    "fixture_sha256": "2e427b205d5fbee337f5c4fe08b24c9402d871ae2f691cf914a0e3dd6866c627",
    "label_source": "human_reviewed",
    "scanner_independent": true,
    "label_provenance_sha256": "b91aa6d492860d6e8b58bfd4a84b47a283e366185e566f28c0e33c3e5648cf22",
    "label_evidence_sha256": "1d0a9782f6a9ceb05d19d14e1409034d7d14e20ee13b629603aa5c9a8bd9e662"
  },
  "expected_findings": [
    {
      "rule_id": "PROMPT_INJECTION_CONCEALMENT",
      "category": "prompt_injection",
      "severity": "HIGH",
      "file_path": "SKILL.md",
      "analyzer": "static",
      "line_number": 11
    }
  ],
  "notes": "Human-reviewed minimal replacement preserving the concealment intent of the historical jailbreak fixture."
}
