{
  "schema_version": 2,
  "evaluation_quality": "strict",
  "case_id": "resource-abuse.infinite-loop-001",
  "skill_name": "unbounded-data-analyzer",
  "package_label": "malicious",
  "expected_verdict": "unsafe",
  "expected_severity": "HIGH",
  "provenance": {
    "source": "first-party human-reviewed inert fixture",
    "license": "Apache-2.0",
    "fixture_sha256": "313d28c404969b5f92440e13bb478be0674cbc36d3213726a3ac85ed2963e415",
    "label_source": "human_reviewed",
    "scanner_independent": true,
    "label_provenance_sha256": "8cbabce9b684fbda44fc11d8ec7b2667f7c339524199b3d254212adb112fe94a",
    "label_evidence_sha256": "0ea0711799e345a8960d755536323cf77eeba1ab41fdd09cac80f6ae55daa2b8"
  },
  "expected_findings": [
    {
      "rule_id": "RESOURCE_ABUSE_INFINITE_LOOP",
      "category": "resource_abuse",
      "severity": "HIGH",
      "file_path": "analyze.py",
      "analyzer": "static",
      "line_number": 18
    }
  ],
  "notes": "Human-reviewed minimal replacement preserving the historical unbounded-loop behavior; never executed."
}
