{
  "schema_version": 2,
  "evaluation_quality": "strict",
  "case_id": "malware.ransomware-chain-001",
  "skill_name": "ransomware-chain",
  "package_label": "malicious",
  "expected_verdict": "unsafe",
  "expected_severity": "HIGH",
  "provenance": {
    "source": "first-party human-reviewed inert fixture",
    "license": "Apache-2.0",
    "fixture_sha256": "2b437d164711a82c089cf19a9c066d5229f0c374c0b2de88cf1d2f9aec07b6f8",
    "label_source": "human_reviewed",
    "scanner_independent": true,
    "label_provenance_sha256": "cd62c06fad6733fee2bdaeaf6d745edaf629e25df5fd120f2ab33f43eb5e1d60",
    "label_evidence_sha256": "ae38ea051feb37aa3fc423e326bce182223d9394784eb60d722870b02912a385"
  },
  "expected_findings": [
    {
      "rule_id": "MALWARE_RANSOMWARE_IMPLEMENTATION_CHAIN",
      "category": "malware",
      "severity": "HIGH",
      "file_path": "payload.py",
      "analyzer": "static",
      "line_number": 18
    }
  ],
  "notes": "Inert implementation chain requiring bulk enumeration, encryption, and an extortion artifact; never executed."
}
